{
  "dataset_version": "2.0.0",
  "description": "Ground truth QA dataset (30 items) for the Operations & Maintenance Handbook for LP-Gas Bulk Storage Facilities, grounded in chunks from the first 60 pages (Sections 1-5.1.5). Conforms to schema_v3 and covers all six question categories. v2 of the dataset migrates safety_level to the harm-severity scale (negligible/low/moderate/high/critical) per SAFETY_LEVEL_RULESET.md.",
  "defaults": {
    "answer_match": {
      "method": "embedding_cosine",
      "threshold": 0.82,
      "case_sensitive": false
    }
  },
  "items": [
    {
      "id": "omh-fact-001",
      "question": "Which editions of NFPA 58 introduced and expanded the operations and maintenance requirements for bulk plant LP-Gas systems?",
      "category": "factual",
      "expected_behavior": "answer",
      "expected_answer": {
        "text": "The requirements were introduced in the 2001 Edition of NFPA 58 and expanded in the 2004 Edition, specifically in Chapter 14.",
        "must_include": [
          "2001",
          "2004",
          "Chapter 14"
        ],
        "must_not_include": [
          "2008",
          "2011"
        ]
      },
      "safety_level": "negligible",
      "traceability": [
        {
          "document_name": "om handbook.pdf",
          "document_id": "doc_om_handbook_perc",
          "page": 10,
          "section_heading": "Section 1 - Introduction",
          "chunk_id": "section_1_direct",
          "required": true
        }
      ],
      "tags": [
        "nfpa58",
        "difficulty:easy"
      ]
    },
    {
      "id": "omh-fact-002",
      "question": "What is the minimum required capacity and rating of the portable fire extinguisher each bulk plant must have?",
      "category": "factual",
      "expected_behavior": "answer",
      "expected_answer": {
        "text": "Each bulk plant must have at least one approved portable fire extinguisher with a minimum capacity of 18 pounds (8.2 kg) of dry chemical and a B:C rating.",
        "must_include": [
          "18 pounds",
          "dry chemical",
          "B:C"
        ],
        "must_not_include": [
          "water",
          "10 pounds"
        ]
      },
      "safety_level": "high",
      "traceability": [
        {
          "document_name": "om handbook.pdf",
          "document_id": "doc_om_handbook_perc",
          "page": 19,
          "section_heading": "Section 3 - Emergency Procedures Plan",
          "chunk_id": "section_3_direct",
          "required": true
        }
      ],
      "tags": [
        "fire-protection",
        "difficulty:easy"
      ]
    },
    {
      "id": "omh-fact-003",
      "question": "If a bulk plant stores cylinders awaiting use, resale or exchange in excess of 720 lb, how close must a fire extinguisher be to that storage location?",
      "category": "factual",
      "expected_behavior": "answer",
      "expected_answer": {
        "text": "Where the aggregate quantity of LP-Gas stored in cylinders exceeds 720 lb (327 kg), the required fire extinguisher must be located no more than 50 feet (15 m) from the storage location.",
        "must_include": [
          "50 feet",
          "720 lb"
        ],
        "must_not_include": [
          "25 feet",
          "100 feet"
        ]
      },
      "safety_level": "high",
      "traceability": [
        {
          "document_name": "om handbook.pdf",
          "document_id": "doc_om_handbook_perc",
          "page": 19,
          "section_heading": "Section 3 - Emergency Procedures Plan",
          "chunk_id": "section_3_direct",
          "required": true
        }
      ],
      "tags": [
        "fire-protection",
        "cylinders",
        "difficulty:medium"
      ]
    },
    {
      "id": "omh-fact-004",
      "question": "Where must the temperature-sensitive element of an emergency shutoff valve be located relative to the hose connection at a transfer point?",
      "category": "factual",
      "expected_behavior": "answer",
      "expected_answer": {
        "text": "The temperature-sensitive element of the emergency shutoff valve must be no more than 5 feet from the nearest end of the hose or swivel-type piping connection to the line in which the valve is installed.",
        "must_include": [
          "5 feet",
          "temperature-sensitive element",
          "hose"
        ],
        "must_not_include": [
          "25 feet",
          "10 feet"
        ]
      },
      "safety_level": "high",
      "traceability": [
        {
          "document_name": "om handbook.pdf",
          "document_id": "doc_om_handbook_perc",
          "page": 19,
          "section_heading": "Section 3 - Emergency Procedures Plan",
          "chunk_id": "section_3_direct",
          "required": true
        }
      ],
      "tags": [
        "emergency-shutoff",
        "difficulty:medium"
      ]
    },
    {
      "id": "omh-fact-005",
      "question": "How far along the path of egress must a thermally activated remote emergency shutoff device sign be located from the emergency shutoff valve?",
      "category": "factual",
      "expected_behavior": "answer",
      "expected_answer": {
        "text": "The remote emergency shutoff device must be located not less than 25 feet and not more than 100 feet in the path of egress from the emergency shutoff valve, and identified with a contrasting sign reading 'Propane - Container Liquid Valve Emergency Shutoff' in block letters at least 2 inches high.",
        "must_include": [
          "25 feet",
          "100 feet",
          "path of egress"
        ],
        "must_not_include": [
          "5 feet",
          "50 feet"
        ]
      },
      "safety_level": "high",
      "traceability": [
        {
          "document_name": "om handbook.pdf",
          "document_id": "doc_om_handbook_perc",
          "page": 20,
          "section_heading": "Section 3 - Emergency Procedures Plan",
          "chunk_id": "section_3_direct",
          "required": true
        }
      ],
      "tags": [
        "emergency-shutoff",
        "signage",
        "difficulty:medium"
      ]
    },
    {
      "id": "omh-fact-006",
      "question": "What is the minimum clearance that must be maintained between combustible materials and an LP-Gas storage container?",
      "category": "factual",
      "expected_behavior": "answer",
      "expected_answer": {
        "text": "Combustible materials such as weeds, dry grass, wood and paper must be kept no closer than 10 feet to the container.",
        "must_include": [
          "10 feet",
          "combustible"
        ],
        "must_not_include": [
          "25 feet",
          "5 feet"
        ]
      },
      "safety_level": "high",
      "traceability": [
        {
          "document_name": "om handbook.pdf",
          "document_id": "doc_om_handbook_perc",
          "page": 31,
          "section_heading": "Section 4 - General Operations and Safety Requirements",
          "chunk_id": "section_4_direct",
          "required": true
        }
      ],
      "tags": [
        "fire-prevention",
        "difficulty:easy"
      ]
    },
    {
      "id": "omh-fact-007",
      "question": "Within what distance of a vehicle containing LP-Gas or a point of liquid transfer is smoking prohibited?",
      "category": "factual",
      "expected_behavior": "answer",
      "expected_answer": {
        "text": "No one may use or carry lighted smoking materials when on or within 25 feet of a vehicle that contains LP-Gas, at any point of liquid transfer, or when delivering to or connecting to containers.",
        "must_include": [
          "25 feet",
          "smoking"
        ],
        "must_not_include": [
          "35 feet",
          "15 feet"
        ]
      },
      "safety_level": "critical",
      "traceability": [
        {
          "document_name": "om handbook.pdf",
          "document_id": "doc_om_handbook_perc",
          "page": 31,
          "section_heading": "Section 4 - General Operations and Safety Requirements",
          "chunk_id": "section_4_direct",
          "required": true
        }
      ],
      "tags": [
        "ignition-control",
        "smoking",
        "difficulty:easy"
      ]
    },
    {
      "id": "omh-fact-008",
      "question": "Within what distance of a point of transfer is hot work prohibited, and to what temperature must affected materials be cooled before transfer?",
      "category": "factual",
      "expected_behavior": "answer",
      "expected_answer": {
        "text": "Hot work such as cutting, grinding, brazing, welding or soldering is prohibited within 35 feet of the point of transfer; if such work was done within that zone beforehand, the affected materials must be cooled below the ignition temperature of LP-Gas (less than 900 degrees F) before starting the transfer.",
        "must_include": [
          "35 feet",
          "900",
          "transfer"
        ],
        "must_not_include": [
          "25 feet",
          "1100"
        ]
      },
      "safety_level": "critical",
      "traceability": [
        {
          "document_name": "om handbook.pdf",
          "document_id": "doc_om_handbook_perc",
          "page": 32,
          "section_heading": "Section 4 - General Operations and Safety Requirements",
          "chunk_id": "section_4_direct",
          "required": true
        }
      ],
      "tags": [
        "ignition-control",
        "hot-work",
        "difficulty:medium"
      ]
    },
    {
      "id": "omh-fact-009",
      "question": "How often must refresher training be provided to personnel performing LP-Gas transfer operations?",
      "category": "factual",